{
  "task_id": "TB-TD-0041",
  "source_mode": "trace-derived",
  "difficulty": "medium",
  "dimension": "prospect-qualification",
  "input": {
    "hiring_signal_brief": "4 open engineering roles posted \u2014 up -6 in the last 60 days. Python roles: 2. Layoff event in the last 120 days: {'date': '2026-01-28', 'headcount': 210, 'percent': 0.18}. Modern data stack detected: Snowflake.",
    "bench_summary": "Tenacious provides pre-vetted senior engineers on 2-week deployment timelines. Available bench: ML (5), Python/Backend (6), Fullstack (4), Data (3). NestJS stack committed through Q3 2026 on Modo Compass engagement.",
    "prospect_profile": {
      "company_name": "Glenmark Commerce",
      "company_size": "501-2000",
      "segment": "Post-layoff / cost-discipline",
      "requested_headcount": 4,
      "tech_stack": [
        "Snowflake"
      ],
      "ai_maturity_score": 2.0,
      "signal_confidence": 0.1
    }
  },
  "candidate_output": "",
  "ground_truth": {
    "required_signal_references": [
      "Python",
      "4",
      "Glenmark"
    ],
    "banned_phrases": [
      "hope this finds you well",
      "circle back",
      "touch base",
      "synergy",
      "leverage",
      "best-in-class",
      "reach out",
      "loop you in",
      "end-to-end",
      "just wanted to"
    ],
    "required_elements": [
      "calendar_link",
      "company_name_mention"
    ],
    "tone_markers": [
      "direct",
      "evidence-based",
      "specific",
      "low-pressure",
      "competence-signaling"
    ]
  },
  "rubric": {
    "scoring_type": "hybrid",
    "threshold": 0.75,
    "dimensions": [
      {
        "name": "banned_phrase_check",
        "weight": 0.3,
        "check_type": "not_contains",
        "description": "No banned phrases from Tenacious style guide.",
        "check_value": "hope this finds you well|circle back|touch base|synergy|leverage|best-in-class|reach out|loop you in|end-to-end|just wanted to"
      },
      {
        "name": "signal_reference_check",
        "weight": 0.3,
        "check_type": "contains",
        "description": "Must reference at least one hiring signal from the brief.",
        "check_value": "Python|4|Glenmark"
      },
      {
        "name": "calendar_link_check",
        "weight": 0.1,
        "check_type": "regex",
        "description": "Must contain a calendar booking link.",
        "check_value": "(calendly|cal\\.com|savvycal|hubspot meetings)"
      },
      {
        "name": "tone_judge",
        "weight": 0.3,
        "check_type": "llm_score",
        "description": "LLM judge scores on 5 Tenacious tone markers. Pass = avg >= 4/5.",
        "check_value": ""
      }
    ]
  },
  "metadata": {
    "week10_trace_ids": [
      "prospect_002"
    ],
    "week10_probe_ids": [
      "P-001",
      "P-026"
    ],
    "source_email_subject": "preserving delivery capacity post-restructure",
    "partition": "train",
    "created_at": "2026-04-29T06:42:10.518090+00:00",
    "seed": 42
  }
}