{
  "task_id": "TB-PG-0035",
  "source_mode": "programmatic",
  "difficulty": "hard",
  "dimension": "prospect-qualification",
  "input": {
    "hiring_signal_brief": "Helios Robotics laid off 12% of staff 3 months ago but is now rehiring. Signal confidence is low.",
    "bench_summary": "Tenacious provides pre-vetted senior engineers on 2-week deployment timelines. Typical engagement: 3-6 months, option to convert. No placement fees.",
    "prospect_profile": {
      "company_name": "Helios Robotics",
      "company_size": "51-200",
      "segment": "Series A SaaS",
      "requested_headcount": 2,
      "tech_stack": [
        "Go",
        "PyTorch",
        "TypeScript"
      ],
      "ai_maturity_score": 3.0,
      "signal_confidence": 0.55
    }
  },
  "candidate_output": "",
  "ground_truth": {
    "required_signal_references": [
      "laid off",
      "rehiring"
    ],
    "banned_phrases": [
      "hope this finds you well",
      "circle back",
      "touch base",
      "synergy",
      "leverage",
      "reach out",
      "loop you in"
    ],
    "required_elements": [
      "calendar_link",
      "company_name_mention"
    ],
    "tone_markers": [
      "direct",
      "evidence-based",
      "specific",
      "low-pressure",
      "competence-signaling"
    ]
  },
  "rubric": {
    "scoring_type": "hybrid",
    "threshold": 0.75,
    "dimensions": [
      {
        "name": "banned_phrase_check",
        "weight": 0.3,
        "check_type": "not_contains",
        "description": "No banned phrases.",
        "check_value": "hope this finds you well|circle back|touch base|synergy|leverage|reach out"
      },
      {
        "name": "signal_reference_check",
        "weight": 0.3,
        "check_type": "contains",
        "description": "Must reference signal.",
        "check_value": "laid off|rehiring"
      },
      {
        "name": "calendar_link_check",
        "weight": 0.1,
        "check_type": "regex",
        "description": "Must contain calendar link.",
        "check_value": "(calendly|cal\\.com|savvycal|hubspot meetings)"
      },
      {
        "name": "tone_judge",
        "weight": 0.3,
        "check_type": "llm_score",
        "description": "LLM judge on 5 tone markers.",
        "check_value": ""
      }
    ]
  },
  "metadata": {
    "week10_trace_ids": [],
    "week10_probe_ids": [],
    "partition": "train",
    "created_at": "2026-04-29T06:47:03.720852+00:00",
    "seed": 42,
    "generation_params": {
      "company_size": "51-200",
      "segment": "Series A SaaS",
      "ai_maturity_score": 3.0,
      "signal_confidence": 0.55,
      "headcount": 2
    }
  }
}